{
  "doc_type": "pipeline",
  "version": "1.0",
  "json_schema": "https://api.dataplatform.ibm.com/schemas/common-pipeline/pipeline-flow/pipeline-flow-v1-schema.json",
  "id": "24cc9881-f83a-4d38-b15b-8bf541e100fa",
  "primary_pipeline": "empty-pipeline",
  "pipelines": [
    {
      "id": "empty-pipeline",
      "runtime": "scala-spark-2.0.1",
      "nodes": [
        {
          "id": "a34ae440-0c3d-4f0e-b5a7-ddf9e45db746",
          "type": "binding",
          "app_data": {
            "ui_data": {
              "image": "/images/common_node_icons/sources/source_var_import.svg",
              "x_pos": 32,
              "y_pos": 62.5,
              "label": "Var. File"
            }
          },
          "output": {
            "id": "outPort",
            "app_data": {
              "ui_data": {
                "cardinality": {
                  "min": 0,
                  "max": 1
                },
                "label": "Output Port"
              }
            }
          }
        },
        {
          "id": "c079dc28-f325-4caa-99f4-8c3d04987503",
          "type": "execution_node",
          "op": "",
          "app_data": {
            "ui_data": {
              "image": "/images/common_node_icons/operations/operation_select.svg",
              "x_pos": 575,
              "y_pos": 70.5,
              "label": "Select2"
            }
          },
          "inputs": [
            {
              "id": "inPort",
              "app_data": {
                "ui_data": {
                  "cardinality": {
                    "min": 0,
                    "max": 1
                  },
                  "label": "Input Port"
                }
              },
              "links": []
            }
          ],
          "outputs": [
            {
              "id": "outPort1",
              "app_data": {
                "ui_data": {
                  "cardinality": {
                    "min": 0,
                    "max": -1
                  },
                  "label": "Output Port"
                }
              }
            }
          ]
        },
        {
          "id": "b16deb33-4e84-45f1-a7d2-6a2e5d8d2618",
          "type": "execution_node",
          "op": "",
          "app_data": {
            "ui_data": {
              "image": "/images/common_node_icons/operations/operation_select.svg",
              "x_pos": 38,
              "y_pos": 333.5,
              "label": "Select3"
            }
          },
          "inputs": [
            {
              "id": "inPort",
              "app_data": {
                "ui_data": {
                  "cardinality": {
                    "min": 0,
                    "max": 1
                  },
                  "label": "Input Port"
                }
              },
              "links": []
            }
          ],
          "outputs": [
            {
              "id": "outPort1",
              "app_data": {
                "ui_data": {
                  "cardinality": {
                    "min": 0,
                    "max": -1
                  },
                  "label": "Output Port One"
                }
              }
            },
            {
              "id": "outPort2",
              "app_data": {
                "ui_data": {
                  "cardinality": {
                    "min": 0,
                    "max": -1
                  },
                  "label": "Output Port Two"
                }
              }
            }
          ]
        },
        {
          "id": "f43f5f8f-7fc2-4979-8c3e-461df32db739",
          "type": "execution_node",
          "op": "",
          "app_data": {
            "ui_data": {
              "image": "/images/common_node_icons/operations/operation_select.svg",
              "x_pos": 298,
              "y_pos": 63.5,
              "label": "Select1"
            }
          },
          "inputs": [
            {
              "id": "inPort",
              "app_data": {
                "ui_data": {
                  "cardinality": {
                    "min": 0,
                    "max": 1
                  },
                  "label": "Input Port"
                }
              },
              "links": []
            }
          ],
          "outputs": [
            {
              "id": "outPort",
              "app_data": {
                "ui_data": {
                  "cardinality": {
                    "min": 0,
                    "max": -1
                  },
                  "label": "Output Port"
                }
              }
            }
          ]
        },
        {
          "id": "aae22a0a-d7e5-4162-902b-450a0147ed26",
          "type": "execution_node",
          "op": "",
          "app_data": {
            "ui_data": {
              "image": "/images/common_node_icons/output/output_table.svg",
              "x_pos": 837,
              "y_pos": 69.5,
              "label": "Table"
            }
          },
          "inputs": [
            {
              "id": "inPort",
              "app_data": {
                "ui_data": {
                  "cardinality": {
                    "min": 0,
                    "max": 4
                  },
                  "label": "Input Port"
                }
              },
              "links": []
            }
          ],
          "outputs": [
            {
              "id": "outPort",
              "app_data": {
                "ui_data": {
                  "cardinality": {
                    "min": 0,
                    "max": -1
                  },
                  "label": "Output Port"
                }
              }
            }
          ]
        }
      ],
      "app_data": {
        "ui_data": {
          "comments": []
        }
      }
    }
  ],
  "schemas": []
}
